{
  "row_id": "5a7c9e1f-3b5d-4e7a-8c9e-1f3b5d7a9c24",
  "upload_id": "4f6b8d0e-2a4c-4d6f-9b8d-0e2a4c6f8b13",
  "origin": "csv_upload",
  "keyword": "شركة تصميم مواقع",
  "keyword_normalized": "شركه تصميم مواقع",
  "market": "KW",
  "language": "ar-KW",
  "avg_monthly_volume": 320,
  "volume_state": "valid",
  "volume_source": "Google Keyword Planner",
  "volume_period": "2025-09/2026-08",
  "intent": "commercial",
  "target_url": "https://example.com/ar/services/web-design",
  "priority": 2,
  "fidelity_label": "user_supplied",
  "validation_errors": [],
  "merged_row_ids": [],
  "created_at": "2026-10-02T08:12:30Z",
  "lineage": {
    "record_id": "5a7c9e1f-3b5d-4e7a-8c9e-1f3b5d7a9c24",
    "project_id": "1c3e5a7b-9d1f-4a3c-8e5a-7b9d1f3a5c80",
    "site_id": "2d4f6b8c-0e2a-4b4d-9f6b-8c0e2a4b6d91",
    "source_type": "user_upload",
    "source_id": "keyword_upload:4f6b8d0e-2a4c-4d6f-9b8d-0e2a4c6f8b13",
    "source_version": "keyword-upload 0.1.0",
    "captured_at": "2026-10-02T08:12:30Z",
    "as_of": "2026-08-31T23:59:59Z",
    "market": "KW",
    "language": "ar-KW",
    "device": "all",
    "method": "csv_import",
    "methodology_version": "0.1.0",
    "fidelity_label": "user_supplied",
    "content_hash": "sha256:536b47fb2ed9cba4b96d741b095703c3df6b47fb744ab3efd818cfaee62ef9d4",
    "parent_ids": [],
    "validation_state": "valid"
  }
}
